{
  "$schema": "https://lidaixingchen.github.io/brutxui-vue3/registry-manifest.schema.json",
  "name": "brutx-vue",
  "schemaVersion": 1,
  "registryVersion": "0.1.0",
  "buildTimestamp": null,
  "gitCommit": null,
  "itemCount": 87,
  "items": {
    "accordion": {
      "integrity": "sha256-53f06ca63d8df737e12de01e036bb6c3e7fed3324f925a1468871d95c3f679cb",
      "fileCount": 9,
      "dependencies": [
        "@lucide/vue",
        "reka-ui"
      ],
      "registryDependencies": [],
      "category": "navigation",
      "examples": []
    },
    "alert": {
      "integrity": "sha256-db27c66b415d8c6a7e28539332fd24eb8bac89473127d53a78e7d915b8c1566d",
      "fileCount": 7,
      "dependencies": [
        "@lucide/vue",
        "reka-ui"
      ],
      "registryDependencies": [
        "button",
        "locale-zh-cn"
      ],
      "category": "feedback",
      "examples": []
    },
    "alert-dialog": {
      "integrity": "sha256-25707c690ac788d5f3e158c497e046d6beaac76d389f3258647a0b2b55560f44",
      "fileCount": 12,
      "dependencies": [
        "reka-ui"
      ],
      "registryDependencies": [
        "button"
      ],
      "category": "overlay",
      "examples": []
    },
    "auth-card": {
      "integrity": "sha256-5766bf00f8c1c5c2b571e2e9d84c109973dbf24167c824f300c7cef8a7ceb0b3",
      "fileCount": 5,
      "dependencies": [
        "@lucide/vue"
      ],
      "registryDependencies": [
        "button",
        "card",
        "input",
        "label",
        "locale-zh-cn"
      ],
      "category": "layout",
      "examples": []
    },
    "avatar": {
      "integrity": "sha256-139961da511f55bc396629e6eadc30707c35dd5e506681532d980c5d454da677",
      "fileCount": 7,
      "dependencies": [
        "reka-ui"
      ],
      "registryDependencies": [
        "locale-zh-cn"
      ],
      "category": "data-display",
      "examples": []
    },
    "backtop": {
      "integrity": "sha256-aa62724ae48988c22e23bdf6527299ae8cbdb82cc533adf0bbfb85ccd3ce2b32",
      "fileCount": 4,
      "dependencies": [
        "@lucide/vue"
      ],
      "registryDependencies": [
        "button"
      ],
      "category": "navigation",
      "examples": []
    },
    "badge": {
      "integrity": "sha256-0c18da022a0d84603cdcf9f022a8ae564df2904bb0ae8e25c03212ebecffe11c",
      "fileCount": 6,
      "dependencies": [
        "@lucide/vue"
      ],
      "registryDependencies": [
        "locale-zh-cn"
      ],
      "category": "feedback",
      "examples": []
    },
    "before-after": {
      "integrity": "sha256-605489fcbae2b045e807495415e8816d4e8fa863cfb1b3f6556bcdc7b5448632",
      "fileCount": 7,
      "dependencies": [
        "@lucide/vue"
      ],
      "registryDependencies": [
        "locale-zh-cn"
      ],
      "category": "visual-effect",
      "examples": []
    },
    "breadcrumb": {
      "integrity": "sha256-68f378f99ef67debb91c340e14b15de8d43bd4f344d47045fde5036c6181b093",
      "fileCount": 12,
      "dependencies": [
        "@lucide/vue",
        "reka-ui"
      ],
      "registryDependencies": [
        "locale-zh-cn"
      ],
      "category": "navigation",
      "examples": []
    },
    "brutalist-hero": {
      "integrity": "sha256-73aeef3e6d29c61da545fcaa76f279e0bf9dcfb065514a08f91d76a791af0d38",
      "fileCount": 4,
      "dependencies": [
        "@lucide/vue"
      ],
      "registryDependencies": [
        "badge",
        "button",
        "card",
        "locale-zh-cn"
      ],
      "category": "marketing",
      "examples": []
    },
    "button": {
      "integrity": "sha256-6ba7a367a5ea0768abeee7425cb872805214838b77d493fdc2ddac38e4a64d90",
      "fileCount": 11,
      "dependencies": [
        "@lucide/vue",
        "reka-ui"
      ],
      "registryDependencies": [
        "locale-zh-cn"
      ],
      "category": "action",
      "examples": []
    },
    "calendar": {
      "integrity": "sha256-40716ad66e4ca850f698b88916edf8595da96ee31f51a187e9bdea41cd8f9fc5",
      "fileCount": 5,
      "dependencies": [
        "@lucide/vue",
        "reka-ui",
        "v-calendar"
      ],
      "registryDependencies": [
        "tooltip"
      ],
      "category": "data-display",
      "examples": []
    },
    "card": {
      "integrity": "sha256-32ea09ad7fd933d388ecef4fa33d211b4eef39b19aa579894fe01c678752f071",
      "fileCount": 9,
      "dependencies": [],
      "registryDependencies": [],
      "category": "layout",
      "examples": []
    },
    "card-3d": {
      "integrity": "sha256-be27c6390e84625b0f13f062ab38e09e35be99da706fe82262dabd76dc208589",
      "fileCount": 7,
      "dependencies": [],
      "registryDependencies": [
        "locale-zh-cn"
      ],
      "category": "layout",
      "examples": []
    },
    "carousel": {
      "integrity": "sha256-f925947d558621e24181945f304d8ceb32420a59f5ef4c3cdaa39ea3a505efd1",
      "fileCount": 13,
      "dependencies": [
        "@lucide/vue",
        "embla-carousel-vue"
      ],
      "registryDependencies": [
        "button",
        "locale-zh-cn"
      ],
      "category": "data-display",
      "examples": []
    },
    "cascader": {
      "integrity": "sha256-c58049c920d6a15daaba54f9fb32ae207e08c7aa5f8f78d14eba144d09a1f08e",
      "fileCount": 11,
      "dependencies": [
        "@lucide/vue",
        "reka-ui"
      ],
      "registryDependencies": [
        "checkbox",
        "locale-zh-cn",
        "popover"
      ],
      "category": "form",
      "examples": []
    },
    "chat-bubble": {
      "integrity": "sha256-b7034e5417f41fa24af1267f8cea339335475bed3ddbb89c39da14f787b190c3",
      "fileCount": 6,
      "dependencies": [
        "@lucide/vue",
        "reka-ui"
      ],
      "registryDependencies": [
        "locale-zh-cn"
      ],
      "category": "data-display",
      "examples": []
    },
    "checkbox": {
      "integrity": "sha256-6f2ec2734b2050e204332b03727f5bd250005c7c62804b162a3d5bb4fa8706dd",
      "fileCount": 7,
      "dependencies": [
        "@lucide/vue",
        "reka-ui"
      ],
      "registryDependencies": [
        "locale-zh-cn"
      ],
      "category": "form",
      "examples": []
    },
    "code-block": {
      "integrity": "sha256-a37a32da4c0e7630d4c04996dbc0b8187047f60203376fabf00888445d9719b9",
      "fileCount": 7,
      "dependencies": [
        "@lucide/vue",
        "prismjs"
      ],
      "registryDependencies": [
        "button",
        "copy-to-clipboard",
        "locale-zh-cn"
      ],
      "category": "data-display",
      "examples": []
    },
    "color-mode-switcher": {
      "integrity": "sha256-b5f1e265b40d1b7f4314745e838db44d0bddcafeba00cf1efeef565ac3d41b80",
      "fileCount": 5,
      "dependencies": [
        "@lucide/vue",
        "reka-ui"
      ],
      "registryDependencies": [
        "button",
        "locale-zh-cn",
        "select"
      ],
      "category": "utility",
      "examples": []
    },
    "color-picker": {
      "integrity": "sha256-f4a425cc9ee0d25181b5464d621dfcd57cb53f1ff13df55ca4cf45f7cc8e4b62",
      "fileCount": 16,
      "dependencies": [
        "@lucide/vue",
        "reka-ui"
      ],
      "registryDependencies": [
        "button",
        "locale-zh-cn",
        "popover"
      ],
      "category": "form",
      "examples": []
    },
    "combobox": {
      "integrity": "sha256-160b5fcc7bda3851495fae764c600dc24229748cb4a589117d8e8ffa4b5f8d95",
      "fileCount": 8,
      "dependencies": [
        "@lucide/vue",
        "reka-ui"
      ],
      "registryDependencies": [
        "button",
        "command",
        "locale-zh-cn",
        "popover",
        "spinner"
      ],
      "category": "form",
      "examples": []
    },
    "command": {
      "integrity": "sha256-98b259f92307a688d90585bc6c0418ed43bc76aed208141f831276c486269c2d",
      "fileCount": 14,
      "dependencies": [
        "@lucide/vue",
        "reka-ui"
      ],
      "registryDependencies": [
        "dialog",
        "locale-zh-cn"
      ],
      "category": "overlay",
      "examples": []
    },
    "cookie-consent": {
      "integrity": "sha256-ac685ebb572498a4aa0ce71dcc339fbd3fabd956e265db56de00d2d52bc1801a",
      "fileCount": 4,
      "dependencies": [
        "@lucide/vue"
      ],
      "registryDependencies": [
        "button",
        "card",
        "locale-zh-cn"
      ],
      "category": "marketing",
      "examples": []
    },
    "copy-to-clipboard": {
      "integrity": "sha256-fe79a2c5cc4842de32860bead0fff7e222145f903ce795867564be7b056a6203",
      "fileCount": 8,
      "dependencies": [
        "@lucide/vue"
      ],
      "registryDependencies": [
        "locale-zh-cn"
      ],
      "category": "utility",
      "examples": []
    },
    "counter": {
      "integrity": "sha256-6396088203a3c4340ca8694f28ac0e31aa701e053fcfc3ad8b3b8f901abacf63",
      "fileCount": 5,
      "dependencies": [],
      "registryDependencies": [],
      "category": "data-display",
      "examples": []
    },
    "dashboard-shell": {
      "integrity": "sha256-dbade840846b7cf1f6da6ca801af62ab6f7c6f7fc0974512262f3a8d7028e936",
      "fileCount": 4,
      "dependencies": [
        "@lucide/vue"
      ],
      "registryDependencies": [
        "button",
        "locale-zh-cn"
      ],
      "category": "layout",
      "examples": []
    },
    "data-table": {
      "integrity": "sha256-b13ef8896f1a628daf29db767b6b01db845b65b1189cdc76b1462425923fd24d",
      "fileCount": 14,
      "dependencies": [
        "@lucide/vue",
        "reka-ui"
      ],
      "registryDependencies": [
        "button",
        "checkbox",
        "input",
        "locale-zh-cn",
        "popover",
        "select",
        "virtual-scroll"
      ],
      "category": "data-display",
      "examples": []
    },
    "date-picker": {
      "integrity": "sha256-3504e36011dcabaa088f575f7d5dee0fb4a84240ff23717ad75073bc0135467d",
      "fileCount": 24,
      "dependencies": [
        "@lucide/vue",
        "reka-ui",
        "v-calendar"
      ],
      "registryDependencies": [
        "button",